processed_review,sentiment_score,sentiment_label
athlet use comfi want love cushion like foam spring look amaz that feel like slip roll ankl shoe materi stretchi feel like child craft foam fabric great want light weight seller wrong classifi crosstrain run mayb pretti hous slipper also narrow foot peopl like 2d foot squish top sole width usual fit size 9 95wa go return love look comfi athlet,0.9729,1
gorgeou fabric didnt give admit bought shoe look cool ive alway love reebok comfort first put love walk around hous hour felt tight fabric realli didnt stretch even much leather might bought 8 12 12 size larger normal buy didnt feel comfort move 9 wasnt length problem inflex sadli sent back,0.9466,1
good exercis shoe look great enjoy lack shoe lace butwhen get fast pace walk inclin walk feel like im walk angl like im roll ankl think im go stick athlet shoe workout still cute around town though,0.9423,1
design comfi first love designsecondli comfort great sole bounci sneaker overal lightmi size 75 u woman 39 europ woman sizei use two week therefor tell longlast hope last 23 year love design textur sneaker muchth color white get dirti easili recommend run raini dayand 50 cool pair sneaker must say pretti nice price run shoe becom quit expens recent price rang usual 60,0.9764,1
cross train sneaker comfort fit expect use around hous ok cross train materi like neopren work walk outsid slant ground foot slide,0.8271,1
nice shoe comfort flexibl wear an11 12 order 11 broke wonder blister problem absolut love style look amaz,0.6124,1
okay like way look comfort howev way sole make easi roll ankl weak ankl breathabl,0.4588,1
great walk downhil comfi shoe shoe stretchi materi make tough walk hill feel like foot go fall toe area otherwis comfi feel like im walk cloud,0.8225,1
comfort think run small didnt size correctli hard tell materi toe shoe stretchi seem ok home comfort actual wasnt went trail great tie unti shoe keep shape,0.4943,1
comfort shoe realli good runner support arch amaz purchas anoth pair,0.7964,1
worth wear le month virtual learn mess dont realli go place often wreck,-0.5423,0
wore fast know 7yo play hard expect shoe last two month front piec almost dangl look like mesh rip like fit adida think go back nike durabl,0.7889,1
great find price cant beat son love picki shoe,0.1857,1
shoe excel soft good thank,0.8126,1
great would order great qualiti,0.8481,1
shoe look pictur show good realiti look ok look appeal would skip,0.6249,1
great sneaker narrow foot greta shoe son love unfortun run narrow,0.8519,1
slightli small great qualiti shoe look great good valu run slightli small,0.9022,1
grandson love fit perfectli,0.7717,1
light fast kid love shoe easi put light fast,0.6369,1
top shoe top price love color sneaker also fit like glove run wonderfullov,0.8957,1
chic sneaker beauti shoe comfort wearfit great wardrob,0.8271,1
nice shoe light comfort,0.6486,1
comfort light sneaker super comfort light sneaker surfish beat fold wear longer,0.836,1
one size would better optic modern,0.4404,1
well fit well,0.6908,1
diadora scarpa camaro use comfort shoe ideal walk lotfor ideal cold medium season cold would also say springaesthet wonder remind model boy spectacular color,0.8519,1
nice product cut regular fit made product larg sizeth product niceth seller kind collabor return phasehighli recommend selleruntil next timethank yourenato,0.8442,1
diadora plea continu shoe arriv origin packag daysth color look realli nicer valuabl photo onlinean excel comfort citi sneakeralmost nobl cooldiadora plea keep,0.8126,1
unfortun notveri comfort cutebut first time tri wash wet spong lukewarm water patrack happen color stab piti like servic amazon top customersmad approv,0.4019,1
posit judgment noth add everyth went well experi,0.2732,1
good vintag style muchi cmq satisfiedthey fit littl big comfort,0.7845,1
excel everyth bought item alreadi yellow model believ valu money excel fast express perfect product,0.8658,1
comfort product compliant punctual deliveri expect,0.3612,1
satisfi beauti shown photodaili,0.0,1
ok part tip leather product photo seem canva howev overal would say ok conveni aesthet,0.5267,1
good construct perfect older ladi goe walk comfort fresha curiou fact fast ship first time amazon give order sunday,0.8689,1
wrong size smaller,-0.4767,0
excel beauti,0.4588,1
beauti comfort beauti shown photo comfort absolut like green teenag son happi yet broken brightli super,0.8074,1
kappa comfort beauti beauti sneaker bad larg took usual size 44 unfortun larg gave say comfort willord size,0.128,1
perfect great fast ship good price enchant,0.8934,1
kappa shoe nooo never qualiti ruin 2 monthsplant comfort,0.678,1
good small normal carri 38 time small pressestherefor return,0.4404,1
shoe pleasantli surpris well made look prettyfor price find realli super clear buy recommend,0.8779,1
good qualiti fast deliveri nice shoe good qualiti fast deliveri price topich would buy,0.8225,1
super shoe fit perfectli super fast deliveri top price,0.9022,1
nice shoe plateau sole shoe illustrationth sole high plateau doesnt bother like itrun well,0.5894,1
size appliesveri comfort also wide feetsiz appliesveri comfort also wide foot,0.6124,1
excellentattent experi fan puma brand alway buy number 9 perfect specif model bought nine cut super fair recommend buy half number fromwhat accustomedfrom tenni beauti materi finish short recommend alway arriv earli recommend purchas amazon excel attent servicethank mexico,0.9678,1
love last fairi thin foot number ask fori alreadi read comment mention last fair true contempl larger number usual mei smell either tight,0.872,1
mu narrow junction 8 ask 8 12 long issu narrow right junctioni use without sock yet squeez,0.0,1
excel model narrow understand model make reduc size ask 3000 sinc size 295 differ size minimali fair,0.6486,1
parent excel design first finish,0.4588,1
order size 11 u small check size,0.0,1
tenni tailor husband good measureand beauti model beauti,0.4404,1
smaller number good qualiti reduc size come,0.4939,1
excel good,0.7096,1
wasnt say arriv late size kid say adult 11 like 8 fit tri return help scam,0.4588,1
comfi easi walk dayveri comfort,0.3612,1
highli recommend product beauti well reinforc size correspond request gray color beauti,0.5574,1
goodth measur usual neither big boy come comfort recogn,0.3612,1
son use comfort love,0.7717,1
good qualiti good qualiti start littl narrow use engag,0.7003,1
exact size comfort qualiti type activ,0.3612,1
nice excel qualitycorrect size,0.7003,1
good tenni beauti comfort pretti size excel,0.8126,1
good qualiti qualiti,0.4404,1
product qualiti comfort,0.3612,1
puma awesom shoe super comfi love puma shoe great style check,0.9217,1
cute shoe shoe cute skinni leg jean thrill inner sole realli isnt one insid feel unfinish bare foot plan purchas inner sole give shoe complet feel,0.8176,1
boot child perfecti would buy,0.0,1
beautifulthey beauti delic,0.0,1
cheap rubber boot daycar center sinc found rubber boot daughter shop citi size simpli sold decid order realli complet satisfi herewel process waterproof fit perfectli yet still offer enough space thick sock colder daysin addit look realli chic realli fine term process,0.6597,1
nice well fit rubber bootsour daughter love rubber boot color unicornth boot make good solid impress doesnt bad sweat foot itdefinit purchas recommend price,0.9696,1
boot daughter goodbuy 5 year old daughter excurs river rainstri excel valu moneyth interior boot remain hot dri allth sole shop avoid slide fall also good buon purchas,0.5719,1
beauti bad qualiti imag chose product girl like hors unicornsth first use trial home garden absenc pozzangher imag alreadi ruinedtoo bad suitabl form,-0.6705,0
comfort imagin angri comfort color boot girl willingli use walk well sompat imagin use unicorn small bonu child like materi excit hope last time,0.8885,1
good boot choos correct size buy real size child current wear bigger accord measur scheme attach page order least one size bigger wrong mistak kept boot next season anyway like boot overal order one size smaller ti right size girl wear,0.3182,1
bring child strengthen sweat didnt want fall back discount time test rubber boot unfortun disappointedmi daughter realli wet sock afterward sweat strongli hereso far shoe boot,0.2681,1
aw chemic odorat boot aw odorat take plastic bag stay day aerat noth help aw odorat chemic plastic everywher hous unfortun go backth boot larg foot,0.4019,1
like look boot toddler materi flexibl enough bend walkingth boot also difficult 2yearold daughter,0.0,1
super rubber boot order great rubber boot daughtersh wear size 23 order one size larger 24sinc meant boot smaller agre withth boot put spring fitw kept realli super beauti also perfect term qualiti,0.9485,1
twice twice wrong size twice return articleord n42 41 arriv first return chang articl also spoke amazon oper sure replac right size noth replac alway made incorrect size,-0.0258,0
small size good soft sole smalltalo 41 bought 41 small return,0.4404,1
poor qualiti total disast broken right awaythey two month bare use alreadi detach broken heel,-0.8519,0
excel beauti comfort shoe son satisfi,0.6705,1
perfect sneaker excel sneaker fit well intern sole comfort,0.9153,1
perfect beauti,0.5719,1
wrong sizereceiv 41 425 order 425receiv 41 style color qualiti top topfor two star,-0.3182,0
good product beauti truli comfort shoe minim element nice style,0.802,1
excel product,0.4588,1
second time confus size shoe beauti second time tri buy wrong size,-0.4767,0
well made attract shoe sturdi well made attract look better person photo fit well far length width unfortun return left shoe rub ankl bone guess heel fit low allow shoe high enough ride bone instead insert might fix issu dont like alter new shoe im sure issu anatomi shoe design,0.945,1
awesom clark best love shoe support comfort fit exactli right,0.9442,1
run small got size 11 send back couldnt even get foot overal theyr cute shoe wont work,0.4588,1
short love style sorri short foot fit like 10,0.8481,1
small small right shoe,0.0,1
grip sole bodi stretch regular wear realli want love shoe initi comfort three week daili wear vacat bodi shoe stretch least full size walk discov light drizzl sole zero grip,0.7906,1
broken two monthsi like two month use broken toe use run sport maximum two hour day lousi qualiti buy,-0.5719,0
perfect size good like much,0.8442,1
lack bit width one two brand prefer work,-0.3182,0
perfect 12 hour shift love asic light fit foot perfectli perfect 12 hour shift frontlin realli impress particular shoe,0.9517,1
worst asic ever got replac gel excit 7 quiz asic websit told would best fit want someth cushion last pair there noth soft sole like run barefoot pavement heel narrow run heel goe sole pinch sole shoe wall give blister bottom heel ive tri run dont get better knee ankl hurt within first mile due lack support feel shock heel everi strike wish could return plea dont wast money,-0.1043,0
great larger shoe size shoe cute nice fit comfort also appreci dont make size 10 foot look like wear water ski worn weight lift run issu rub sore foot,0.9136,1
comfi tri 4 differ shoe end return except pair theyv ea joint pain knee foot long run definit recommend,-0.2023,0
comfi love shoe super bounci miracul make huge foot look small,0.886,1
cant wait buy anoth pair absolut love shoe order anoth pair ive ran mine use everyth super cute light took wear week get broken max comfort level,0.8885,1
excel qualiti good qualiti fit well,0.8591,1
disgust sneaker ever bought look feel fake glue everywher anoth thing insol look come ten dollar made china sneaker bargain store name anywher rememb reebok name insoledefinit feel look cheap bought home plantar fasciiti even suck home hardwood floor outsid feel even worst oh thing 0 grip lol rubber slip plastic wast money,-0.886,0
love 775 shoe reebok alway worn 75 saw review warn ran small miner mist 75 22 sohad tri first thought small lot thick stiff decid keep anyway mention 22 within hour wear felt fantast think 8 would loo gorgeou color vibrant pictur complaint left shoe teeni bit narrow across top see photo isnt notic unless your look im give 22 pair ill get cant even deduct star itlov retro style great color would definit recommend wouldnt hesit repurchasemi pix without flash show color differ reflect strip,0.8555,1
awesom hike boot hike absolut love boot purchas use quit pair reebok shoe year ago rememb much love comfort comfort hope would specif look reebok found wear 8 8 fit perfectli love came black purpl shoelac,0.9719,1
good look shoe product look nice comfort shoe desper need comfort insol insid shoe hard took coupl day break thought would comfort continu wear case late return stuck recommend shoe,0.9062,1
return love color height shoe arch support better averag went half size normal size larg side wear hour around hous ball foot hurt terribl return base experi would steer clear reebock brand,0.8402,1
great mow bought need good pair rug shoe mow perfect wish 7 12 size would fit perfectli 8 wear thicker sock foot dont slide much comfort took one time wear becam relax well worth money,0.9622,1
kinda big top even lace way love everyth except wide lace pull lace way right still much room shoelac come undon face even loosen doubl knot said love shoe color width sole comfort werent big top shoe,0.9176,1
love size 12 size love lot support look great true size 8 order 85 review say size 12 size im glad fit wiggl toe top think true size would tight perhap,0.9801,1
love love color comfort ankl support caught guy sale could resist review mention size run small worri im natur larg size order entir full size fit perfectli,0.9442,1
tenni sole separ month two separ sole tenni without effort,0.0,1
old school shoe came promptli look great,0.6249,1
nice shoe great quit stylish comfort peopl alway ask got cours dont tell smile,0.8069,1
love bk flash back 90 love way fit feel foot,0.8979,1
love bk rememb back high school love look theyr actual comfort wear stylenostalgia sport,0.8979,1
great throwback sneaker great 80 theme parti went recent,0.8481,1
comfi cuuuut love bk true size comfort seller ship immedi via fed ex issu,0.8591,1
comfort narrow toe cushion insid,0.3612,1
throwback get mani compliment love shoe perfect throwback look go turn realli comfort also im alway get peopl stop look ask bk find im think need color,0.9062,1
excel qualiti materi manufactur cute love new bk,0.8807,1
great shoe bad lace lock great shoe bad lace lock stop hold lace tight week tri get replac lace lock unsuccess bit disappoint pretti expens toddler shoe,-0.4019,0
stylish great fit look,0.765,1
small shoe sent back unfortun small,0.0,1
nice comfort littl wide cool even though bit largei alway use adida 38 23 bit larg usual,0.765,1
comfort maximum size bit larger normal howev fit perfectli,0.6124,1
top top,0.3818,1
comfortablecomfort easi carryperfect run beauti color fit everyth,0.3612,1
qualiti perfect price walk go field path,0.5719,1
happi pretti basketbal comfort recommend,0.6124,1
order complet 100 perfect satisfact,0.5719,1
comfort ugli sin shoe expect 1 afford dont want pay 40 good pair shoe 2 ugli sin depict 3 comfort welcom 45yo,-0.0583,0
excel support shock absorb shoe trail walk comfort right box fit well purchas a105 narrow foot like heel area realli absorb shock purchas abl walk wood trail abl comfort walk rock root dirt complet support shock absorb cushion 6 month accord pedomet put million step still comfort new would recommend trail use even good walk shoe pavement cushion purchas anoth pair time replac,0.9451,1
top wider child foot order model son 2 year row rel wide high feetth shoe keep warm also waterproofi recommend,0.6369,1
usato non nuovo medium could load prodotto e arrivato usatoin discrizion era scritto nuovonon e possibil non posso restituir,0.0,1
super top,0.6908,1
good like fit littl short littl wide usual put narrow foot,0.7845,1
comfort problem foot see,-0.0516,0
five star love,0.6369,1
five star great 95 year old mother hammer toe,0.6249,1
min said perfect expect min said perfect,0.8126,1
five star great shoe,0.6249,1
discont return big yet reimburs money,0.0,1
origin beauti shoe shoe origin man eye orma grand run half size perhap 1 whole normal ask size 7 look good equal underpath 75,0.7096,1
littl two big ware heaver sock look great,0.6249,1
great great product,0.8481,1
accommod truli comfort soft foot walk,0.3612,1
stitch stitch came apart 1 time wear,0.0,1
may expect refund shoe much larg,0.0,1
fit like glove amaz comfort amaz,0.7579,1
everyday wearer love shoe im dancer im wear flat seller super dilig connect make sure understand measur base measur put tape measur footsinc im wear everyday shoe ive put insol made bit tighter leather eventu adjust happi purchas,0.886,1
care pick size pro made nice seem like comfort fitcon run larg foot 7 medium width read review went 7 that nike sketchersrelax fit sneaker size 65 still big order least 6 still fit interest good free return option amazon prime caus easi find fit return dont think order anoth size caus dont feel right zumba slipperi ankl support might good danc lesson like ballet nonprof foot narrow high arch would even recommend go 7 6 caus time tendenc strech easili insert finger photo includ,0.9882,1
bought 16 year old son bought 16 year old son music normal wear 11 12 tenni shoe size 12 fit perfectli,0.3612,1
awesom purchas need order jazz shoe daughter audit earn role local commun theater first time u idea shoe onlin order ultim decid base good review im glad perfect fit expect good qualitytheyv stood last three month rehears still look great refer daughter size 56 depend shoe,0.959,1
look deceiv shoe look like three time smalluntil put realiz stretch arch area allow hell heel pad ball foot despit heel pad feel barefoot part design buy look wantne someth rigid offer support around foot shoe essenti leather sock someth solid underneath withstand wear danc plan danc lot want last cobbler add leather sued sole bottom surfac floor contact last price order anoth pair wear fit comfort howev want insert kind liner front toe section shoe least odor manag comfort primari reason fact front shoe pad toe rest insol rippl leather extrem uncomfort insol shoe fall short 2 cm mayb 1 tip front shoe pad toe press stictch rib materi leather shoe sewn sole pad look pictur descript see leather ripplesridg toe areather liner sole pad cover area insid shoe toe happi easi cheap solut purchas trim insert thin shoe liner reach way front shoe happi shoe great practic even danc social care other step foot protect top toe happi danc,0.9716,1
big shoe seem fine go size guid larg especi consid need start fit tight stretch dont know dancer like shoe fit loo sloppi want fit like second skin foot toe need abl spread dont want foot slide slip insid shoewil need return order smaller size order 7 12 wear size 8 8 12 size street shoe hard compar danc shoe danc shoe need fit differ street shoe also line insid one shoe bent would uncomfort wear hope next pair line roll,0.8651,1
perfect even chair yoga get chair stand pose wear size 85 shoe need orthod sometim go half size even full size order fit perfect orthot super soft leather like barefoot support need seat stand pose perfectli would take miracl,0.9584,1
held realli well son danc lot music theatr look order amaz long last well year sole get worn still look pretti good support 15 still grow think probabl order larg side super comfi danc forget take class get sore use regular shoesbut need get tan color instead black remeasur foot order one size definit stick brandfor price think perform realli wellal seam still perfect noth rip torn use show wear sole leather part toe partli foot grow adult kid danc probabl last 6 12 month new look like pictur show dont need broken,0.9307,1
foot ground jazz move follow direct purchas shoe size two wear 10 12 11 cut small know get 12 13 wide foot great qualiti use shoe mani time buy,0.4588,1
measur instruct wayyy huge also hideou read mani review decid manufactur suggest measur daughter foot heel toe exactli 9 34 inch base manufactur guid order 85 gut knew wrong usual wear 75 8 max base guidelin went huge huge hideou wear 9 huge need asap hop order size 75 think entir size would better wrong 75 better still entir size big point gave took local danc store poni 15 extra cost v fit great much attract would recommend worth time send monster back lol,0.9686,1
satisfi fit perfectli franc imposs find footbal shoe size bad cant tri field moment,-0.25,0
great soccer shoe wide foot super producut describ,0.8402,1
articl deliv incorrect unfortun 44 arriv instead 45 made made,0.0,1
super best shoessnow deliveri mega price,0.8442,1
satisfi fit well fast deliveri fit,0.7269,1
fast deliveri good descript fast deliveri fit perfectli,0.6597,1
super comfort like cloudstepp line super comfort like cloudstepp line love slip like slip shoe dont provid lot side support said worn noth el sinc buy realli want tie shoelac men certain age shoe done well,0.9808,1
didnt fit well didnt like fit look return,-0.7306,0
clark shoe problem foot order hous shoe shoe arriv tri perfect break period shoe perfect order thank great product,0.9062,1
comfort look good fit expect,0.7845,1
ok advertis fast deliveri,0.296,1
horribl clear cleat break second done,0.3818,1
well excel shoe materi process food heavi narrow shaft front toe feed thick could hardli closedat proud price would expect littl,0.802,1
unfortun sole immobil small boot unfortun sole immobilemi son couldnt walk shoe went back,0.0,1
feed warm also nice also design insol furhighli recommend,0.7351,1
defect sole shoe father shoe unfortun sole loosen side shoe,-0.34,0
good qualiti good price great shoe dh who recov knee replac surgeri comfort good solid footb easi suggest order half size usual theyr perfect fit fast deliveri thank amazon prime,0.9758,1
great shoe comfort light weight order exact size extra wide perfect fit shoe hard find thank amazon,0.9393,1
happi found new balanc well made right fit,0.5574,1
four star great shoe servic,0.6249,1
good fit everyday wear,0.6597,1
nb sneakermuleoh cool comfort stylish son autism wide foot plantar fasciiti caus heel pain addit discomfort flat foot true size well craft highli recommend,0.6249,1
fit differ old 801 slipon realli love old discontinu 801 sliponclog need replac whatev regular nb sneaker size appropri im usual 105 nb tri 105 11 105 best one said fit differ 801 heel lift back sneaker seem littl narrow even though width differ design get use enough new one date better look perspect,0.946,1
slide shoe slide slip realli comfort howev wish would bought half size smaller fit perfect first bought month losen peopl said cant run well kid slide slide foot tri run far low back ummm slide hello suppos low back want someth higher back shoe slide would give 5star size issus cot point,0.7708,1
perfect wear day sever month pretti consist use love issu whatsoev worn expect im work wear leisur consist beach campground around hous etc pictur wear 4 month,0.7717,1
construct par nb back heel cup soft rebound step onto older nb slipon solid im hope bring back old model built like nb run shoe outstand,0.7184,1
favorit shoe shoe cheap product also inexpensivebut that exactli sonsinc wear deposit order one size larger exchang exist deposit orthopedicsinc junior alway race shoe join look goodjunior wear two month especi extrem satisfiedno wet cold foot okay winterso recommend,0.6808,1
great shoegreat shoe good fit light good qualityth price also reduc clear purchas recommend,0.9477,1
good tenni exercisethey fit well comfort trainingthey heavi go day day,0.8402,1
beauti comfort color nice size adjust perfect light super comfortablei recommend purchas wide,0.9371,1
love beauti problem packag arriv,0.3612,1
heavi hot plantar fasciiti shoe beauti mean beauti also well made leather suprem howev wear horribl wear hot shoe extrem heavi within week wear also develop plantar fasciiti,0.2732,1
great shoe great price love shoe far got pale pink basic neutral skin tone im 8 85 usual size 8 fit perfectli lot support shoe soo comfort worri sued show dirt quickli treat sued protector far good,0.9729,1
sued describ shoe comfi get lot compliment howev zero sued shoe final cushion comfort line even box say sued sued leather aho,0.6808,1
good bargain price shoe attract seem true size feel bit heavi like heavi shoe havent worn shoe yet look like arch support ill use insert good bargain price sure real reebok logo missingfrom shoe word reebok imprint sole shoe come reebok box,0.9627,1
cuter person cute comfi mix leather nylon thing littl roomi 75 got friend wider foot good would buy 7,0.9081,1
good good fit well use shoe lift weight gym danc flat nice color heard other good qualiti updat issu appear,0.9337,1
reebok slowli becom favourit brand reebok fire excel work art love fit great size 8 bought size 8 perfect severli excit pair sneaker would recommend anyon,0.9559,1
ask half number reduc,0.0772,1
wait lost size 255 cmand sent 235 cmshame pretti,-0.3182,0
good buy nice tenni shoe son love color sold as vibrant person look good foot,0.9451,1
great hardcourt shoe far shoe awesom far morton neuroma foot im alway look shoe wider toe box cushion play twice hard court toe jam plenti cushion tri b width well littl snug wide felt realli roomi end work great court break period 50 player im rough shoe see well hold,0.9246,1
super uncomfort excit receiv look cool flashi immedi tri super uncomfort creas top lace cut toe would bend foot take step surpris review claim comfort need break must got bad pair return differ brand entir,0.8316,1
