processed_review,sentiment_score,sentiment_label
cushion unfortun case shoe made ball foot burn ten minut walk sidewalk feel would give callus easili suppos comfort shoe diabet dont understand felt hard bottom almost like left cushion shoe also seem stiff usual propet black washabl walker theyr great dont come beig taup khaki look,0.8443,1
shoe sole crack 6 week occasion wear worn brand year found sole virtual indestruct therefor shock sole left shoe crack bottom footb seller request pictur provid hasnt respond sinc extraordinarili disappoint,-0.7579,0
bottom broke halv wife rough shoe bottom broke two halv middl long use poor qualiti dont buy,-0.8271,0
poor materi use sole sole somewhat expens shoe split across ball foot yesterday one shoe complet start split across inner part sole wear work sit front comput sinc septemb 2017 except 2 snowi month winter end march 2018 throw away total wast money hard shoe pair black new balanc bought sear five year ago still wear understand term plan obsolesc ridicul pair shoe cost 9000 propet get act togeth,-0.5423,0
materi flake 4 use wast money materi outer part shoe flake 4 use,0.0,1
ok foot shape like brick size 7 12 2e shoe shop ok foot shape like brick size 7 12 2e shoe shop unpleas chore order use pn last pair purchas local store great price got 2 pair use work everi day hope extend life rotat pair shoe fit surpris find could tell slight differ pair slight differ known shoe break stretch leather might put bit could happier product qualiti fast deliveri,0.9682,1
narrowi 39 usual 24cm decid guid comment ask le well also beauti narrow hurt half hour use go wallapop,-0.3182,0
nice comfort buy shoe three year truth delightednow true somewhat expens hey like everyth el use daili last year truth show authent good,0.9417,1
beauti perfectit beauti noth envi brand renowvictoria alway meet expect greatmi daughter delight themth size precis one use usual shoe,0.5994,1
botn blanco victoria size 36 comfort size exact use 36 fineth bad thing rubber sole yellowish horribl ye want return blow 5 decept price cheap mustment without ugli color,-0.1779,0
goodcomoda coupl use adapt foottalla quit similar star,0.0,1
originalth shoe pretti come origin box wrap packag box give origin brand,0.0,1
correct good materi seem resist beautifulth number ask larg tad although prefer squeez fabric first bit hard suppos use give type footwear depend whatthey last would buy,0.4215,1
cool bother width bit use day give,-0.0258,0
everyth good decid good review disappoint comfort size correct,0.6808,1
good comfort fit well,0.8402,1
great fit price qualiti son love shoe love still look new activ kid wear everyday sinc got,0.9432,1
gift took minut get use son love great qualiti great shoe,0.946,1
size perfect fit,0.7351,1
qualiti qualiti echura excel,0.4588,1
great shoe top sellerth product exactli wishther problem custom everyth finei would buy,0.4939,1
ur game wmatch lace like nmd r1 adidasso much bought total 5 time overal comfort stylish attent grab make sure match nmd color match lace well,0.8126,1
authent fit expect saw question review say smaller bigger etc expect compar nmd fit expect woman wear 75w men equival accord adida 65m got 6m believ review fit fine gotten 65m would better offmi recommend worri size go local store tri order size felt comfort store nmd go sizeand ye real inspect arriv shine light sole produc expect result,0.9349,1
go dolphin love favorit team color,0.6369,1
great shoe let start love shoe nice featherweight comfortablei give four star honestli inspect shoe end end top top found chip shoe damag also look like deep clean good job saw part shoe still kinda dirti collect shoe person collect nmd buyer got shoe authent came origin box box wasnt damagedupdatetipshow tell nmd faketh shoe pictur box slant like banana liketh size tag malemleth size tag 13 digit bottom row uniqu secur number differ left right shoemak sure shoe dont come wrap plastic bag easi tear paper adida logo alittl fadedmak sure part put lace doesnt extra leather stick outmak sure sew legit noth look wrongthey zigzagth nippl dot never past 4 dot go vertic,0.9826,1
super comfort wide foot let start point find tenni shoe comfort ive 4 pair util blacksolar pink blueblackcor trace oliveblacklim blackgreysolar pink wide foot tenni shoe seem strangl foot howev nmd r1 stlt provid comfort fit sneaker tri knit mesh wrap around foot feel like wear sock boost sole give respons cushion effect like walk cloudi normal wear size 11 purchas 115 compens dr scholl plantar fascit insol use shoe also recommend wear low cut cushion tab sock cushion ankl tenni shoe provid cushion ankl,0.9578,1
worth look shoe came recommend variou run site made invest look solid shoe use walkrun shoe arriv littl surpris construct tri fit nice wore short walk wife push took longer walkrun higher tempo heel shoe tore heel bloodi batter time done needle say anyth impress,0.9042,1
great walk work realli comfi love sock shoe style green color isnt flashi distanc mute green like closer get bright show havent tie tightli dont know well perform actual athlet activ use daili wear better walk shoe gener street shoe,0.9412,1
wide long load stretch adida level 11 comfort im bit sneakerhead dont footwear beatl stone attitud sneaker manufactur creat equal bless u awesom apparel miss get nmd colour wheel first releas see amazon bargain price made world better place fit wide across toe give max spread slightli short though id suggest half size bigger youd buy nike adida boost sole super comfi primeknit upper basic strong stretchi materi give support tonn movement lace decor im total fine,0.975,1
great shoe ideal user shoesi wore pair shoe week extrem comfort peopl would like go gym train street run 30 mile week person street run jog gym 3 mile daili shoe protect foot well also shoe flexibl easi wear without take care shoelac peopl long distanc runner shoe decreas vibrat step ground protect knee help keep stabil run increas balancewhat size buythi pair shoe fit littl bit bigger normal shoe size still recommend go true size shoe sport jog foot bigger normal buy shoe half size may littl small hurt feetwhat featur shoe hasfor pair shoe breathabl excel jog gym feel fresh cool foot person like sweat sport shoe keep foot dri comfort say abil water resist pair shoe resist water wear shoe street long time feel cold shoe thin light ideal summerthi shoe use boost technolog adida make shoe sole flexibl comfort fantast look first time saw pair shoe said look durabl heard shoe ultra boost technolog didnt well boost technolog wore shoe jog daili use sinc receiv great far expect shoe handl heavi duti jobsthank time question leav comment respons soon possibl,0.9943,1
love love super comfort lightweighus daili walkingperfect fit,0.9538,1
want everi color shoe nice probabl wont run wear casual gym even day comfort light highli recommend,0.7585,1
edit review still worth price wasnt expect super high qualiti shoe bought mainli look white sporti shoe definit dont fit true size wear 11 bought 11 seem fit like 11512 would highli suggest buy half size normal wear arent cushioni sole arent uncomfort either lightweight good price would buy ye would make sure order half sizeedit wash wash machin white shoe dont stay white forev clean right also shrunk enough fit even better bought let air dri left origin review could see first thought ad anoth star shoe wash realli good shoe also gotten comfort wash wear,0.8313,1
pain bad foot silli buy get review joke bad foot absurdamazon stop sell thesethes shoe desir orthoped surgeri futur bad let other tri see bad feel among friend your better walk barefoot unless there glass floor show podiatrist said wors foot shoe hed ever seen payless plea good especi arthriti buy,-0.8519,0
great shoe price ive want white shoe awhil decid get high top normal price pay definit get money worth say like abl run even tie im abl pull fairli easili even high top materi feel like gauz tape surprisingli comfort walk around went get mail experienc problem shoe got statement piec henc super gay sock pink short lol wear gym mayb event ill like order color well dont expect shoe last long time feel could cut entir shoe scissor price like wont mind replac,0.9648,1
im buy anoth pair shoe sooo comfort stress easi wear around sometim youll forget theyr even ye peopl stare look like realli expens shoe arent ive mani peopl compliment wear howev warn ankl support nonexist first wore nearli roll ankl think like normal sneaker depict photo soft flexibl realli clean shape im consid buy second pair,0.872,1
husband said get pay alright bought im cheap tell wish save moneythey bright brilliant white light weight that appeal know got ta fit gym help anyway work foam soul zero traction could see slip tiniest water droplet liner pop everi time take offer support jump squat wouldnt dare run eitherso learn save money invest qualiti product,0.9729,1
freak awesom shoe said husband order husband larg foot travel make luggag weigh alot shoe weightless husband love use last cruis order differ color travel adventur highli reccomend,0.3182,1
brand 12 inch bigger normal brand realli comfort shoe expect good shoe replac turn shoe comfort btw normal wear size 10 one order 10 12 sold out10 turn perfect fit,0.9201,1
worth buy husband bellman also vallet four season said comfort shoe he far prior one sketcher adida would pay big price ever someth comfort that go get dirti love breathabl sweat work foot day last order new pair sinc final go back work furlough year recommend sure cant beat price fee get,0.926,1
disappoint well bought shoe ive read told good brook shoe figur id give tri side sole dig side foot soon put shoe felt first pair brook disappoint mayb kind got bad cut glue job shoe also seem bit narrow expect either way return probabl wont tri brook brand,-0.3818,0
narrow foot work narrow foot usual size 10n sinc review said ran narrow decid tri order half size recommend 105 medium roomi look larg foot seem comfort enough first tryon though decid ignor vaniti keep yet wear sever day straight remodel work hous found heel pain night decid return order anoth style 10n sinc rang come size normal wear narrow shoe recommend would also say need order half size fit like 105 medium list,0.8442,1
shoe defectivecreas toe absolut love style look brook unfortun one tie develop uncomfort creas toe area make unwear shoe tri 3 differ pair size shoe everi pair creas toe area rub toe way see pictur wore around home 30 minut creas becam uncomfort sadli return find anoth comfort model aspect shoe great,0.8957,1
left shoe slip outward walk love brook run shoe ive use nearli 10 year ive love everi pair bought sadli pair doesnt sit straight one foot left shoe slip outward walkingrun ive never issu shoe walk work first day put 5 mile shoe tri right went whole day cushion bottom displac slightli wonki like pillow youv put dryer wish could return sinc paid 60 okay drive also work keep handi im disappoint brook point,0.9029,1
left shoe much glue left shoe lot dri glue tongu near two eyelet also size 12 size still snug,0.0,1
comfort slipperi concret love brook shoe wear also work shoe littl disappoint wore day receiv end slip asphalt land knee also slick kitchen oil sole comfort safe wear sinc threw box away return basic wast money far shoe work nurs would recommend run sinc slip asphalt walk,0.8979,1
littl small follow measur instruct order half size small reorder full size 7 instead 6the shoe well construct,0.2732,1
run narrow order size 7 length good narrow realli loosen lace still felt realli tight width wise dont even wide foot wound return,0.7184,1
small true 85 shoe includ model brook reason couldnt even get foot send back shoe nice style though size super weird,0.8316,1
ok get brook foot wont hurt anymor said got pair yeah foot furi still walk averag 8 mile day 2 job im impress,0.8433,1
product excel deliveri flashbi daughter buy shoe addit excel workmanship comfort allow foot make right movement,0.8555,1
great design face mask packag daughter particularli happi includ superhero masksho great look great,0.9231,1
everyth ok beautifulperfect,0.296,1
good,0.4404,1
beauti comfort beauti comfort,0.6124,1
top super pretti comfort,0.802,1
great skecher qualiti fun daughter love perfect shoe super hero lover typic great skecher qualiti comfort fit true size,0.9902,1
good qualiti good price shoe fit perfectli chosen shoe sizein contrast mani cheap brand kappa shoe surviv daili use child foot without damageth priceperform ratio realli good herey also clean wash machin heavili dirti next shoe brand sketcher best child shoe,0.9524,1
le 1 month shoe dissolv bad qualityabsolut recommend regardless price qualiti disappoint,-0.5719,0
great summer shoe great sneaker son didnt want go last summerth shoe robust withstand lotth price greatclear purchas recommend,0.9166,1
look good order didnt tri son big nevertheless look good good qualityord recommend fewer number,0.8885,1
strong chemistri shoe open touch immedi apart wash hand minutesto offer unsustain item child,0.7579,1
origin absolut non origin shoe smell foot child made realli poor materi,-0.4767,0
wrong color deliv otherwis ok expens unfortun got shoe blue instead green look like picturefor price almost 40 expect bit thickerfirm materi longterm test still pend,0.1531,1
well wellbut littl piec velcro littl piec stuckanyway never taken offat moment,0.2732,1
recommend shoe nice color strong,0.8225,1
light shoe look good light featheralso great slipper kindergarten school,0.7906,1
small boot great qualiti seem warm great tread kicker fit whole size small return disappoint,0.872,1
comfort boot good boot top strap slow get,0.7351,1
comfort design flaw comfort stylish major issu strap back help pull nearli imposs put without shoehorn,0.7717,1
great altern heavi hike boot purchas light trail hike altern heavier hike boot moab far love comfort right box lot cushion support order 85 9 review thought ran big usual street shoe 8 12 although wear 95 hike run shoe asic gel kayano 9 perfect 85 short hike,0.9531,1
didnt work insol zero support walk foot hurt bad couldnt keep use shoe bought put new insert band top shoe dig bad imposs wear unless want shoe zero support go someth el husband also bought brand shoe actual support shoe sure woman shoe poorli support huge wast money,0.6249,1
enough arch support need hope good arch support much foot hurt coupl mile probabl ok return sinc theyv alreadi worn outdoor nice shoe feel stabl run close true size bought size 85 mayb tad bit small side,0.9081,1
fit stabil true fit wear 95 bought 95 bunion right foot toe box roomi enough without buy wide width anoth thing need shoe stabil shoe stabil higher side back isnt issu great price,0.5432,1
rock search high low hiker shoe wasnt bulki boot style lightweight hiker fit bill phenomen hike sand mountain trail climb rocki terrain etc although waterproof want big concern didnt plan water lot peopl said rear rub heel area around ankl absolut issu liter wore 810 mile hike right box extrem happi purchas would highli recommend look great hiker without heavi bulki hiker boot,0.8074,1
heavi shoe arch support wellmad otherwis worn merrel mani year socon understand hike shoe tend heavi heavi like weight foot arch issu foot surpris arch felt overli stretch step soul flatpro nice look shoe wellmad comfort except arch issu weightconclus keep shoe add support insid could better need get someth lighter well,0.9325,1
comfort support day 1 wait wrote review realli test merrel hike boot need break time sever day wear work seem good later prove great spent two day walk citi easili 10 mile day pavement curb step foot support sore hadnt found good citi shoe breathabl yet full hole felt wind like shoe ive hike boot 3 year dont show sign wear except shoe,0.9501,1
incred tight hard get shoe appear well construct good support howev tight hurt put matter much loosen lace hard mark foot took hour wear bought size alway wear never need wide width shoe go back,0.3818,1
tight normal wear 75 feel like shoe true size length tongu shoe attach feel like tight band across top foot much left indent 10 minut wear insid hous end return shoe reason felt like comfort sole shoe past attach tongu tight across top otherwis good shoe,0.946,1
shoddi workmanship love merrel shoe decad discov first time plantar fasciiti type enjoy season year receiv pair hike shoe august 7 2021 wear le half dozen time shoelac aglet either miss came cours eventu mean shoelac longer use work properli amazon make return item easi nonetheless still pain return shoe without good hike shoe get new one certainli expect merrel product go forward reflect qualiti merrel product purchas,0.4203,1
big big,0.0,1
good sneaker sneaker white green stripsthey place yellow front sole flat shoe comfortabley run well itthey well suit sport leisur sole removedy see well sole construct differ zonethes zone differ hardship foot well support shoe fit wellthey exactli specifi size,0.9042,1
poor qualiti product poor qualiti asymmetr seam poorli made cut proportionswhen son put went total way,-0.8074,0
excel qualiti slipper beauti good qualiti recommend,0.8126,1
good qualiti come good qualiti love sole slip,0.875,1
cheap son pick loooov dinosaur well cute liter 5 minut unbox one dang horn fell liter brand new theyr broken 3 year old super upset find someth send back print damn return label b everyth close cant ship back easili,0.1531,1
fuzzi cute larg cant believ anyon say fit true size im adult femal size 85 foot daughter size 45 slipper fit perfectli mayb peopl like loo fit slipper though great last year everyday wear good slipper im buy anoth pair size 45 kid slipper size 85 adult foot,0.9674,1
cute stay granddaught love slipper disappoint wont stay back low keep come foot wont wear,0.7441,1
exactli look son autist spd sensori process disord particular love slipper comfort get home school immedi exchang tenni shoe slipper perspect hard bottom case step outsid also machin washabl exactli look fori order size give littl grow room still fit well,0.872,1
comfi slipper poor qualiti construct great slipper except poor sew horn top one horn fall arriv within 2 day 3 horn fall sew back tightli may problem someon needl thread,-0.4588,0
cute fall apart quickli koala pair daughter 8 year rough shoe wore new koala slipper christma within hour one puff ear fell even 2 day later anoth ear came stuf expo im tri convinc daughter return complet sold size tri anoth pair although read review seem problem realli love look probabl keep tri glue back togeth recommend slipper anyon unless want child upset fall apart immedi dearfoam lost custom could sell junki product 20 get away,0.5267,1
super cute washabl slipper daughter love dinosaur slipper cute pas longer avail dearfoam websit sooo excit find amazon daughter wear size 8 toddler shoe current chose 910 perfect easili put take realli love washabl keep smell fresh instead like sweati kid foot lol perfect stock stuffer,0.9872,1
purchas 5 year old son lookswhen climb mountain spring like,0.3612,1
super comfort look shoe halftim weak comfortablew succeededw buy offer 13 super purchas,0.8126,1
origin beauti comfort style,0.3612,1
gola basket happi purchaseveri solid shoei recommend,0.4767,1
five star cool,0.3182,1
okay product great crucial weaknessit dri slowli bracket foot consist fabric suck water need rel long time driedwant go tomorrow often dri,0.4767,1
good flip flop flip flop greatthey fit well sole thicker brand therefor probabl wonder softit pleasanti highli recommend slipper,0.6369,1
meantim almost whole famili wear slipper absolut recommendedbought sever time male woman,0.0,1
good product good valu money,0.7003,1
reliabl deliveri high qualiti,0.0,1
good product use train crossfit moment fulfil goal,0.4404,1
fit littl small snug expect 2nd pair love shoe 2nd pair differ colour fit littl snug across width expect ship took littl longer expect,0.8481,1
size size run littl long half size long,0.0,1
holi grail shoe best around fit shoe ive own speed tr ive done everyth squat short run play basketbal handl capabl dont look bad worn casual either buy themedit still love fit look shoe outsol wear away quickli wore 3 week chunk grip start tear away,0.9654,1
cheap construct previou pair year ago love pair flimsi felt extrem cheap,0.6369,1
feel littl loo worn almost everyth reebok crossfit area shoe fall great turf gym much street shoe hard bottom make great olymp lift turf work anyth 400 meter sprint dont think like shoe,0.6694,1
great style terribl qualiti fit expect realli like color styleveri disappoint shoe expect last lot longeronli 3 12 month use alreadi start get hole mesh see pictur uploadednot expect 90 shoe design crossfitth mesh materi seem abl made intermedi workoutsdo wast money shoe abl get even quarter supposedli last life,0.7506,1
great shoe stabl solid grip shoe great stabl speed work chang direct sprint also solid stiff sole ideal solid base strength train ankl mobil squat without need wedg lift shoe go give stabl base complaint insert dont quit fit insid show side pair pinch heel littl bit first time wore tighten lace littl differ abl fix issu overal im happi would recommend anybodi look train shoe definit ideal distanc run though,0.9647,1
awesom fat foot love reebok sneaker ive long time wearer reebok nano newer model becom narrowi worri first puppi plenti room toe box area hobbit foot feel great gym heavi lift well plyometr work use occasion casual wear also,0.9042,1
bummer earlier model shoe favorit pair gym shoe ever super sad receiv much cheaper materi feel toe box narrow could tell go fall apart quickli sadli instant return,-0.2023,0
ador size complet super cute appear well made howev im true 6 read review order 65 case shoe small legitim even get foot insid label 65 clearli bigger 55 mayb even 5 must buy order least size honestli would recommend buy cant get someth simpl shoe size right would surpris actual construct shoe held,0.9231,1
exceed expect fit perfect comfort sturdi look look even better pictur came wear right away think may live,0.891,1
super comfi fit perfect bought black friday deal best shoe ive bought awhil fit exactli expect usual wear adida your use adida size know size perfect support foot work super comfi highli recommend,0.9828,1
high qualiti good qualiti,0.4404,1
color wear quickli shoe comfort day start notic green color fade white cloth underneath come made shoe spot look odd keep fade day disappoint especi inexpens shoe,-0.3612,0
know everyon love want love soooo bad stink cute hard tri comfort stand 2 minut foot would hurt footb hard even bought wonder thin soft memori foam insert shoe didnt fit tight end keep insol love found relief high hope amaz review send back true fit werent narrow wide foot say lot length fine hard made foot sore mani peopl know love hope luck,0.9705,1
cute comfi watch size came brand new adida shoe box theyr super cute order 8 fit comfort like bit extra space toe end shoe id say order 12 size larger usual make great nurs shoe comfort walk,0.9719,1
final good fit purchas return mani pair black sneaker past sever month thank amazon prime usual brand puma asic reebok either chang size qualiti usual wear size 85 9 sneaker got 85 base review fit adida exactli proport foot wide toe box mild bunion closefit support arch flat foot narrow ankl keep slip fabric cool stretchi without feel cheap wear differ waterresist pair raini day also like subtl blackonblack print black sole wide lace final keeper,0.9485,1
light weight true size comfort 2nd pair ive bought newer edg lux made recycl materi tight hurt cute couldnt get past way felt found shoe onlin sinc find store anymor exactli like one bought last year local sport good storei size 7 fit like wear work nurs would wear daili everyth yardwork work amus park dont rub skin sock low dont hurt foot dont thick pad comfort thick pad walk like brand didnt want would recommend use shoe run jog exercis arent support enough lightweight look bulki wear leg short without feel like heavi look shoe onthey better mesh feel like sock materi foot love dont like sweati foot wear shoe day,0.9713,1
best sneaker ever own 8th pair color mani comfort sneaker earth versatil enough work run errand even wear work henc mani colorsi arthriti knee achil tendin foot life long flat foot person put sneaker feel like foot air pronat walk worsen knee pain foot well support allow walk briskli without painthi rose gold color favorit color,0.8074,1
wear trail side side tread pattern break ankl mud ice snow noth stop later slide slick surfac also front lip game unglu first hike look good though fine social distanc subaru drive,0.3612,1
best shoe purchas year coolest look best qualiti shoe purchas boot doubt buy moment put could physic feel qualiti wrap around foot great arch support well wait go ahead buy,0.9413,1
nike sport pretti bad sent averag sapato size le normal tube pay send return hope return money,-0.25,0
nice sneaker nice lightweight sneaker shoe altern merrel hike shoe usual wear everi day recommend,0.7964,1
honest robust shoe quit robust comfort accord daughterdiscreetli flexibl sole,0.8625,1
love love cool look receiv lot comment comfort,0.9217,1
pretti cool bun daughter alreadi model alway serv,0.3182,1
great snicker happi sinker look great fit comfort,0.9217,1
good purchas price cmoda everyth last closei took half still tightrecommend,0.4404,1
comfort cool im teacher foot day import shoe comfort support well versatil shoe provid also earn compliment student that ice cake,0.9217,1
good also darker photo better color darker appear photo better le dirti,0.8271,1
retro style awesom foot support shoe give foot amaz support super comfort love retro style bought first pair dillard happi find amazon super satisfi,0.9666,1
