processed_review,sentiment_score,sentiment_label
comfort scrap bought exactli 8 week agonow sole approx 12 cm long detach insid hab bought differ color let see langedi hold,0.3612,1
mies qualif four week sole fall offbett buy real shoesmies qualif four week sole fall offbett buy real shoe,0.0,1
shoe fast deliveri shoe meet expect,0.0,1
like cloud super comfort soft inner sole,0.836,1
cool seem comfort quit flexiblemi littl daughter love alreadi ask other older one,0.8402,1
good shoe shoe comfort wear lightlook good im wait long,0.8074,1
love shoemi daughter 4 year old narrow feetw alreadi shoe fifth size also sever color carri kindergarten everi day kindergarten playground also go look like wash machin like new,0.8481,1
would recommend conveni shoe good price perform ratio,0.6597,1
goodgood shoe good qualityobtain lot,0.4404,1
good buy nice look super soft foot feel like wear slipper fit expectedgood buy highli recommend propet good brand name start make qualiti shoe hard fit size,0.9643,1
happi themi bought second pair isnt easi find good fit wear wide size great,0.6362,1
perfect fit right box look pair nice black walk shoe replac current pair look bulkyaka old ladi found decid give shot shoe fit perfectli 10 right box addit light weight attract well made wore walk back forth check rub pinch etctot comfort wide enough toe box medium thick sock shoe pretreat discourag stain sinc sued tag say washablew see never care heavi white athlet shoe look shoe goe cloth much betteri like shoe much husband suggest go ahead purchas second pair sinc frequent compani either stop sell someth chang someth,0.9357,1
shoe new best friend ah sooo glad discov shoe wide foot due bunionett foot shoe even wide width wide enough comfort id like first time order pair shoe coupl year ago got cd width never dream could possibl need anyth wider comfort still saw outsid edg foot push beyond shoe figur id live problem sure anyth wider would wide rest foot took chanc order pair 2e ive come realiz actual need 2e pay measur foot measur think mani folk wear wrong size shoe perfect longer see outsid foot tri push side shoe theyr big elsewher propet washabl walker fit perfectli like made ive sinc order 2 pair differ color shoe wear greatlook wellmad comfi support heavi washabl what love,0.9796,1
cutstyl shoe must differ tight wife love designcolor propet woman w3841 sneaker classic taup howev return small shoe 10 receiv 10 size time also howev cutstyl shoe must differ reason tight foot disappoint appar make size 105 doubli disappoint pay return ship 16 20 cost shoe buyer bewar,-0.1531,0
tender treatment touchi toe love much stock comfi warm toe chilli day without bulk wore broken foot bone heal pain arthriti foot injuri sinc actual fallen asleep look like sued go wash sole flexibl foot ankl dont get stiff overli rigid shoe design gentli make foot work good tire dog sooth foot propet tend run narrowy may want size though first pair b width foot swell sinc first pair got e w either design wide,0.7937,1
nice run larg wish known run larg dont requir wide size howev foot tend wide narrow realiz worn rub toe tad wideiv solv problem thick sox wrap toe order would order half size smalleractu may order anoth pair differ color comfort,0.4767,1
toe taper nice look shoe look like would comfort dont need wide toe box sneaker narrow toe dont make sen tri extra wide width see would make work still narrow toe wide heel,0.7783,1
denim shoe attract shoe arriv quickli good condit order 9 narrow notic ship email indic 95 narrow ship contact matt orthot shop email respond immedi indic would attempt chang size prior ship wrote back later day told unabl intercept orderwhen shoe arriv wife love look feel fit bit roomi narrow foot shoe comfort wear keep mayb propet denim sneaker run halfsiz small workmanship appear qualiti work wife use walk shoe fashion accessori dressi enough wear jean good slack,0.9477,1
comfort ive worn shoe bought wear colder weather weve enter fall temp drop ill soon wear often bought shoe doubl wide ive never bought own pair shoe width wasnt sure expect like extra room toe box ill abl wear thicker sock get cooler outsid treat shoe protect good entir season like neutral color ill abl pair mani differ outfit far theyr comfort im look forward get year use,-0.5693,0
comfort foot end return style wasnt expect dont like order shoe onlin cloth matter alway go hit miss fit mostli least typic miss expect better name brand like skecher,0.8148,1
nice boot ran much smaller normal own mani skecher boot fit well size would like review said ran littl wide expect better fit dont know pair sent mislabel normal wear 10 least 2 full size small good qualiti howev,0.9451,1
decent shoe decent price like look good fit well issu sole isnt best wear foot quickli sinc realli wear social occas doesnt bother much,0.7696,1
good shoe husband wear brand shoe work he foot lot realli like shoe use buy shoe dept havent found last time buy onlin,0.6597,1
wonder extrem slip resist wonder extrem slip resist major plu doubl knee ampute walk find shoe slip resist fit bill nice walk comfort say feel good foot wife say look good well slip resist look good need,0.9485,1
final wide boot fit wide footthi one ad custom insert foot,0.3612,1
littl wide origin order 10 12 normal size sketcher way big reorder 10 fit better still littl big width fit almost like wide versu normal width comfort littl much room width keep use winter boot thicker sock,0.8911,1
nice boot light,0.4215,1
fit great husband love shoe worrisom order onlin zero issu fit wonder work great,0.9545,1
good qualiti comfort great shoe fit true size fianc say comfort,0.946,1
beauti comfort parent smaller number come 5mx ask 4mx stay perfect,0.7579,1
complement fit true size color amaz spring summer cute lot complement fit true size color amaz spring summer,0.9118,1
gorgeou gorgeou great run comfort love color,0.8957,1
big return fit big,0.3612,1
love comfort amaz color trendi love must,0.8979,1
beauti tenni beauti bit tight beauti,0.0,1
cute stylish uncomfort walk found uncormfort rub toe tough,0.3612,1
good good,0.7003,1
great fit see previou post,0.765,1
bargain best design super comfort good materi,0.936,1
great buy great price shoe look feel great husband look good sturdi pair shoe without get dad shoe comfort son 15 12 tooupdat side shoe came apart minim wear disappoint thought finnali found winner,0.9628,1
love except broke honestli favorit shoe ever first time put littl thing help pull shoe back rip easili excit abt time switch stuck tape frustrat super disappoint love shoe much p dirti pic bc ive wear much also realli easi clean,0.9042,1
qualiti price excel grandson love shoe order,0.802,1
comfi stylish son want pair like mine order pair love,0.7906,1
amaz deal love first foot,0.6369,1
son happi new pair champion tenni shoe,0.5994,1
excel good,0.7096,1
good compani shoe fit well,0.7579,1
open box ouch move must miss open box wrong size box say 95w shoe say 85 would love return long sure check insid box right size late wish darn,0.6705,1
decent purchas fit ok insol seem slightli one shoe price theyr good,0.765,1
beauti shoe beauti opinion also good fitth flaw sin fact littl clear remedi polish brown shade darkerth skin certainli preciou far paid would say qualitypric ratio advantag,0.2263,1
spend littl extra get adida nmd first huge adida fan 1 brand wear look normal show stiff feel cheap sorri havent return hang closet also run big make mistak buy order one half size smaller,0.5574,1
color aubergin color comfort shoe still black brown unfortun pictur pictur rather purpl auberginesinc bought reason price keep,0.3612,1
immedi cheap probabl actual adidasthey look like crap wear one day follow advic review bought size fit correctli ugli poorli made shoe hard uncomfort flimsi etc etc etc,0.25,1
wide nice light shoesreal size use thick sock fallveri good leather qualityw space toe even thick socksrecommend anyon wider foot,0.6908,1
huge shoe biggest shoe world wear 8 8 enorm order 7 two inch room im give,0.3182,1
soft leather comfortableth shoe greatthey made soft leather suffici width descript comfortableth color purpl red beautifuli capric shoe satisfi everyonei recommend,0.3612,1
nice shoe order size shoe perfect comfort,0.8402,1
comfort leather shoesh demand feetit worth buy conveni leather light,0.4404,1
cute shoe shoe comfort cute,0.8176,1
rudit comfort leisur shoe fulfil expect,0.3612,1
order size run larg order size great shoe cute wear 85 everi brand shoe includ adida particular one run big,0.7964,1
good product good product flexibl elast leather side shoe allow easili put,0.7717,1
cute true size perfect addit shoe collect comfort,0.9001,1
larg much larg mayb miss label,-0.1531,0
order size smaller big kinda comfort order size smaller big,0.2975,1
comfort volleybal shoe arriv term shoe comfort beauti daughter like muchth measur right arriv right termsadvis,0.7579,1
perfect perfect shoe right number,0.8271,1
nice huge rocket dog brand fan sale took chanc wear size 9 fit true size alreadi receiv compliment dr cute comfi look gon na order pair stylish fit firm tighter slip sinc extra cushion part around ankl like look nice,0.9738,1
comfort expect good look,0.6597,1
nice sho first time wear brand impress,0.6908,1
comfi rather comfort beachi vibe,0.3612,1
cute comfi well price cute comfort well price,0.8934,1
good look shoe instant,0.4404,1
comfi af definit comfi af perfect look someth practic n conveni slip go,0.5719,1
like fit ye good qualiti shoe,0.7845,1
great support great easi refund polici support,0.9274,1
comfort comfort shoe love wear,0.8481,1
reebok shoe seller commun good didnt like shoe,0.1999,1
nice shoe great qualiti reebok nylon classic fast ship 1010 seller,0.7845,1
awesom sneaker amaz price love sneaker pair back 1987 super cute snd comfort happi purchas,0.9274,1
comfort bad like classic look,0.128,1
love love great price,0.926,1
fit expect love daughter fit true size great price,0.9442,1
recommend perfect fit great style son love,0.9517,1
kid like great shoe,0.765,1
wrong size order wrong size,-0.7351,0
good qualiti good product flexibl foot,0.7003,1
awesom feel nice look wow amaz perfect hiit workout strength train thing get use slip given dont open lace area higher ankl bur that matter get use feel abil workout amaz fit true size,0.9578,1
good 25 color pale pink expect size true size concern sole isnt shock absorb sure ill keep feel bit hard sole thick sole cushioni,0.4063,1
nice soft shoe comfi shoe make sure clean regularli maintain color,0.7783,1
super perfect,0.8225,1
throw shoe cute squeez black strip,0.4588,1
good qualiti love brand,0.7964,1
bmx readi great bmx great price fit right,0.8934,1
good look shoe fit expect order size 35 fit 9 year old perfect,0.891,1
look great comfort great colour wear lot casual clothessom arch support nice walk lot compliment,0.9643,1
drop everyth buy 2nd pair love shoe super comfort fashion complaint dont wash well buy pair scotchguard last longer,0.7569,1
love sperri love sperri true size gripe like leather shoe lace replac tie lace hold secur foot easi shoe doesnt bulg make foot look fat,0.9287,1
great shoe fast ship love shoe fit appear great lot like feel bodi cleat nice snugwrap foot narrow foot like snug feel even wider foot wouldnt shi away great qualiti comfi,0.9794,1
cute super comfi bought shoe trip washington dc abl walk around day sightse problem shoe definit winwin cute comfort,0.8658,1
sneaker girl work comfort good arch support attract true size narrowish foot went half size 95 9 im good,0.936,1
larger expect width caus lot larger expect width caus lot heel slide toe jam worn two pair sock ok,0.0,1
comfi shoe comfort tad larg sinc wear arch support shoe work well one shoe came without lace barrel watch sperri youtub video color goe everyth,0.743,1
comfort even though fit bit larger comfortableeven though fit bit larger pair sperri boat shoe,0.7579,1
five star love exactli want,0.6705,1
size chang ive wear merrel slipon hiker year everi year buy size 95m fit perfectlynot time shoe wont even go foot feel like size 8 85 despit label 95mayb brave actual shoe store tri merrel see size new 95m,0.8126,1
ballerina small imposs set foot,0.0,1
great shoe great eveyday shoe went black lil stiff front foot first coupl day leather loosen feel move footid love see merrel make havoc well slip gtx dont wear wide imag wide foot might narrow side great grip ive experienc heel slip breathabl expectedi realli like typic wear 14 went 15 work great hope help buyer,0.9796,1
weirdli small wear men 85 regular width shoe foot size past 52 year wear merrel pretti much exclus past 2 decad consist alway fit alway fit bespokethi pair narrow couldnt get foot shoe good one inch longer heeltoto compar 85 jungl moc wearingweird small,0.7845,1
insan narrow shoe look well made incred narrow life worn size 9 95 order 95 safe couldnt even get forefoot insan narrow merrel make qualiti product serious need fix size,0.3612,1
difficult put despit sever pair merrel moc could even put without fear break shoe horn understand ran smaller typic order one size larger other could bare tri sent back wish fit well other like desert moc good look,0.8963,1
narrow sharp look typic merril qualiti bad narrow slip open small could get difficulti tight need wide normal sent back,-0.5423,0
good qualiti littl tight hope loosen wear time,0.7003,1
run small run away small mislabel,0.0,1
fit smaller expect fit small narrow wear anyth thin sock,0.6124,1
great awesom shoesgreat qualiti,0.6249,1
excel ask larger numberand synthet leather qualiti shoe good complaint aspect two detail first skin tenni synthet skin short word rub beauti sweat footeven drill hot second import quit reduc normal foot thin width ask larger number wide foot ask largest number half importantif want accept part finger tend fairthey beauti heat cold problem toler size take account,0.6705,1
valu money nice qualiti product good look bmw logo,0.6908,1
gift opensi gave husband realli like much amaz friend ask taken beauti particular 5 star husband complain hold long time aa littl uncomfort narrow littl hard past time still case like afraid purchas took offer,0.802,1
bad qualiti premium brand disappoint shoe look nice dont wear itunfortun qualiti miser dispos shoe 5 monthsth bmw logo dissolv short timeth shoe tight almost uncomfortableth fabric heel area worn even though dont wear shoe often look like 10 yearsyou could take shoe decor noth,-0.7096,0
nicethey beauti comfort alway happen puma model narrow front go well wider foot perhap least averag alreadi puma shoe spend 38 model although perhap fair pelin although equal comfortableveri satisfi purchas send alway,0.7096,1
love good truth doubt number ask sinc said smallperson ask half bigger number perfectwhat width somewhat fair noth uncomfort long wella said half number feel greater comfort,0.9301,1
run shoe suitabl road run thin sole price high product use long distanc run hard road develop pain knee toe use shoe run militari train academi due sever pain knee purchas anoth regular run shoe went quit easi run urg dont buy product expens useless,-0.8689,0
perfect shoe excel workmanship puma accustom u beauti also suitabl sleep eleg dress obvious realli excel drive car simul gener take 47 buy 485 that48 better way biggest one justifi fact contain given fact must prevent foot get stuck near pedal,0.8934,1
shoe ok fit size joke narrow foot man usual shoe size 43 bought size 445 pumaand shoe still clearli smalland narrowwhat suppos mean,0.7096,1
fantast qualiti comfort sometim fantast shoe visual photo look high qualiti pretti much best ever worn footsinc wear shoe everi day morn even insid outsid say hardli feel iti actual reorder 3 pair order total 4 pair 2 x cognac 2 x dark browni couldnt miss price 67 love shoe long time,0.8791,1
super comfort well made thought order first let take look impressedveri comfort great qualiti great fit ideal jean definit keep,0.9753,1
boot high qualiti leather comfort carri size correspond one use,0.3612,1
recommend like much look nice realli conveni,0.7783,1
great shoe absolut beauti comfort shoe,0.765,1
marco polo fit usual,0.3612,1
excel product excel priceexcel product pro soccer shoe incred price,0.7184,1
kinda good shoe good insol fell apart real fast first coupl use,0.6386,1
take time break super hard put foot 1 month ive worn 10 time still hard get foot foot actual good cleat take long time break,0.5859,1
best cleat ive ever bought twice get anoth pair take littl bit break,0.6369,1
love shoe im player refere use run 68 hour dont hurt foot,0.7891,1
wide foot shoe made wide foot there wide model clear site,0.3818,1
small small,0.0,1
warm solid much trivial ciabatta addit hot sole suitabl walk gardenveri comfort excel materi,0.7845,1
fantast work announc receiv prescrib timefantast,0.0,1
son love thank,0.7717,1
purchas topperfect beauti,0.0,1
depend sorel brand bought grandson love call cozi shoe wear day long attract well made shoe ive satisfi sorel custom mani year,0.8316,1
love slipper awesom realli comfort warm great nonslip sole must buy,0.9136,1
son love comfort accord 12 year old forgot take head door school fit expect love grey sorel slipper great product definit purchas,0.9565,1
great slipper fit perfectli size comfort warm durabl,0.875,1
super son need new sport shoe sport lesson hall footbal shoesmost indoor sport shoe made narrow foot even greet 45 46well son masculin feetultim shoe third attempt return twow complet satisfi thesethey well made sit well non slip shoot well itso like 5 star,0.891,1
muy chula medium could load estn muy bien son muy chula mi hijo le encantado,0.0,1
nice best,0.7906,1
perfect shoe arriv 1 day perfect,0.8126,1
two star size indic mislead shoe approxim two 2 size smaller averag,0.0,1
super super,0.8316,1
pretti good love,0.7964,1
use shoe stay like defectiveth product expect poor qualiti,-0.1531,0
shoe run narrow order one shoe run narrow order one size read review didnt work shoe squeez foot,0.0,1
prekfert fit well shape,0.5574,1
fit good look great got puma sneaker today fit good look great love,0.9726,1
tt sport,0.0,1
four star bought 12 yr old daughter love,0.6369,1
one star narrowdo stretch,0.0,1
three star item deliv last night mani thank,0.3612,1
comfort beauti comfort,0.6124,1
cute versatil second pair sanuk yoga sling kiddo love ea cute style,0.8807,1
daughter want sandal daughter love sandal theyr comfort hold well great traction flexibl,0.9217,1
good good sneaker,0.7003,1
describ product return describ productthey brook reve 3 send reebok,0.0,1
retro shoe reebok reebok retro sneaker good pricethey comfort carv well,0.7579,1
good qualiti item boot nice design sit well get reebok qualiti nice price nice buy recommend,0.9313,1
dont know happen receiv today realiz one white like bei,0.3612,1
price ok favorit shoe super comfort fit size 41 optim would buy differ color,0.8779,1
amaz increibl,0.0,1
good perfect,0.765,1
nice retrosneak beauti retrosneakersconvinc materi workmanship,0.4215,1
cheap good happi,0.4404,1
awesom final reebok similar reebok satilit 1990 comfort shoe ever own,0.3612,1
good beauti soft materi,0.4404,1
perfect fit daughter daughter love new croc fit perfect theyr great qualiti definit buy need go size,0.967,1
squeaki found shoe nice hope realli super comfort foot squeak domest tile sinc also abl wear shoe offic reallyno option methat would made laugh number everywher shame beauti shoe,0.9169,1
light beauti shoe realli comfort seem protect high impact train initi seem snug foot loosen string first aerob session would say perfect,0.8316,1
buy without doubt worth especi beginn heavi corridor,0.1139,1
super comfort good fitth shoe fit wellcolor shownrapid deliverygladli,0.8957,1
excel total comfort,0.6705,1
good workmanship shoe nice littl narrow meth qualiti excel,0.8271,1
good shoe good product,0.7003,1
comfort shoe walk took 7w comfort fit size perfect orthot,0.8807,1
sharp look comfort fee love look good fit great arch support,0.9578,1
comfort shoe perfect fit comfort love natur shoe stylish comfort one,0.9509,1
nice littl size beauti shoe first time shoe size 7 tighten despit thin foot,0.4215,1
toe area wide width narrow order wide width snug shoe hard walk,-0.1027,0
comfort extrem tight,0.3612,1
beauti girl sandal even wider foot fantast beauti girl sandal look much beauti natura photomi daughter thrill sandal comfort wear adapt wonder foot thank velcromi daughter littl wider foot shoe well suit,0.8225,1
use shoe sent old worn shoe,-0.296,0
great girl sandal insensit color combin nice sandal littl one like straight awayfit dress pantsto adapt foot two velcro fastenerspleas inner solethank,0.8834,1
great shoe realli love shoe,0.8519,1
good qualiti order came time shoe look good unfortun bit small otherwis satisfi,0.7003,1
nice sandal sandal fit desir comfort footb good workmanship,0.8658,1
good sandal toddler good sandal bend soleid toddler,0.7003,1
soft cloud super comfort sandal still firm abl play run properli,0.8316,1
great everyth great,0.8481,1
origin beauti parent bought fairli good price 600 mexican good finm love beauti 100 origin recommend want walk comfort,0.936,1
comfi sweat,0.0,1
true size comfort love,0.8591,1
love bought trip involv lot walk theyr comfi fit well lightweight easi get walk disney world 5 day never got blister chafe foot began hurt last day like much ill buy anoth pair,0.6249,1
awesom comfort,0.3612,1
im keep puma sneaker fit good make foot look smaller that woman thingth item xma gift ill let know xma well famili friend like,0.9062,1
fit size bought sneaker granddaught texa said love sneaker im plea love,0.8979,1
cool realli coolmi wife like,0.5859,1
comfi af super comfi cute love much cheap price amaz walk 1 hour everi day help make foot last 3,0.93,1
love first wear sooooo comfort beauti love four pair,0.8979,1
excel comfort,0.6705,1
excel comfort measur precis suitabl mani occas coupl,0.6705,1
teva sandal came quickli door good fit lighter teva bought good swim walk rock water great malta,0.9081,1
comfort footwear perfect kind activ,0.8625,1
basic yet solid teva sandal know expect qualiti good sandal durabl basic design plank rubber sole nylon strap strap comfort enough wear day time sole mold foot great river shoe someth keep foot protect bit sturdi flip flop,0.8834,1
boyfriend approv suggest boyfriend cancun trip didnt sandal slide enjoy fit like color great walk around water activ,0.7559,1
get half size wonder sandal great qualiti awesom color comfort,0.765,1
awesom comfort fit order son want pair theyr super lightweight comfort great fit love,0.9702,1
sole look cheapli made ive bot teva sandal like shoe look knockoff,0.3612,1
good fit light comfort edc sandal good fit light comfort edc sandal,0.93,1
excel purchas excel qualiti look bought brother use brand went good price,0.836,1
great valu got sale great deal fit half size bigger keep mind im happi overal qualiti boot good construct good comfort cant wait hop bike realli put pace,0.9584,1
five star great boot,0.6249,1
nice boot happi hd boot nice ride motorcycl goe style afford price,0.6808,1
perfect perfect,0.8126,1
excel excel,0.7184,1
harley boot hold promisesit 1st choic motorcycl boot,0.0,1
qualiti boot choic fit choos somewhat smallhowev tall foot high instep club foot boot fit perfectli wear size 9 12 bootsand 9 12 boot issu clearanc top feetpretti tight take break awar tall foot problem chanc tri buy may gone half size meant top boot comfort hard tell without physic compar two sizesthes boot get 5 star asid tight top issu everyth boot scream qualiti first ive alway fan wolverin that make web address stamp bottom boot secondli materi stitch build weight look flawless pair receiv last least boot way cool give cool confid put onkept clean worn occas wed funer rock concert rodeosbi way leather water proof never never bebest thing make water resist possibl get mink oil leather treatment product treat repel water better last longeri ride motorcyclebut dont think motorcycl rider boot like good qualiti boot buy pair,0.9744,1
boot great actual boot good seem built well pretti comfort saftey shoe toe box roomi doesnt cramp toe issu buy shoe onlin fist boot bought big return howev wasnt option return get differ size start return way took almost 4 week get money back buy anoth pair boot differ size fit better still bit loo honestli cant longer meed saftey boot work wardrob plane offer didnt work amazon accept debit card servic,0.9311,1
awesom safeti ride boot one day far 10 hour foot feel great fit fine right box put mink oil last night water proof steel toe compani cover part cost wear safeti boot well ride boot dont believ invok 30 day comfort guarante real nice boot price great price le 2 month leather like peel never scuf there like thin shin peel toe boot tri polish seal better slightest buf caus top layer leather wrinkl tear thinnest layer still comfort boot ive ever worn let see,0.9796,1
good ask number le,0.4939,1
diesel men skb elast slip sneaker conveni light slipon sneaker diesel,0.0,1
size smaller standard new one seem small especi front rubberactu littl small w littl height heel,0.0,1
high techi expect dont know high tech,0.0,1
excel excel,0.7184,1
request size arriv size come ahead product good good shoe tell case wrong first ask size ask 42 sent one size 43 contact custom servic made return request time right size 41 arriv size 42 put incontact custom servic make chang send shoe arriv 42 get touch custom servic return buy 41a 42 number arriv 4 time one number order reach given bought prefer lose good price bought bewait come badli,0.5574,1
good qualityth shoe photo even put ask 42 know carv small use 415and sent 43 3 return continu send 43,0.4404,1
